[
  {
    "clue_id": "clue_burn_pattern",
    "case_id": "case_clockmaker_01",
    "display_name": "工坊地面灼痕",
    "description": "工坊地面上有不规则的灼烧痕迹，呈放射状分布，中央有一个模糊的圆形印记。痕迹边缘没有正常燃烧的焦黑特征，更像是被某种能量瞬间灼烧形成的。",
    "source_type": "environment",
    "location_id": "workshop",
    "reveals_fact_ids": ["fact_ritual_failed", "fact_workshop_damage"],
    "requires_any_tags": [],
    "requires_all_tags": [],
    "strength": 3,
    "missable": false
  },
  {
    "clue_id": "clue_residual_energy",
    "case_id": "case_clockmaker_01",
    "display_name": "异常灵性残留",
    "description": "用灵性感知工坊空间，能察觉到空气中弥散着不自然的能量波动。能量密度在工坊中央最高，向四周递减，呈现出爆炸性释放的特征。残留的能量带有冰冷、漠然的特质。",
    "source_type": "experiment",
    "location_id": "workshop",
    "reveals_fact_ids": ["fact_ritual_failed", "fact_workshop_damage"],
    "requires_any_tags": [],
    "requires_all_tags": [],
    "strength": 3,
    "missable": false
  },
  {
    "clue_id": "clue_lab_notes",
    "case_id": "case_clockmaker_01",
    "display_name": "实验笔记",
    "description": "在工坊工作台上发现了一本皮面笔记本，里面记录了失踪者近两个月来的实验记录。笔记中提到他试图通过古老的仪式召唤并束缚某种灵体，以获得对时间感知的洞察。笔记结尾的字迹变得潦草而混乱。",
    "source_type": "document",
    "location_id": "workshop",
    "reveals_fact_ids": ["fact_experiment_conducted"],
    "requires_any_tags": [],
    "requires_all_tags": [],
    "strength": 3,
    "missable": false
  },
  {
    "clue_id": "clue_material_receipt",
    "case_id": "case_clockmaker_01",
    "display_name": "神秘材料收据",
    "description": "在失踪者公寓的书桌抽屉里发现了一张来自\"星陨材料店\"的收据，购买项目包括银粉、净化草药、秘制墨水和一支标注为\"时之砂\"的稀有材料。购买日期为失踪前一周。",
    "source_type": "document",
    "location_id": "apartment",
    "reveals_fact_ids": ["fact_material_source", "fact_experiment_conducted"],
    "requires_any_tags": [],
    "requires_all_tags": [],
    "strength": 3,
    "missable": false
  },
  {
    "clue_id": "clue_neighbor_testimony",
    "case_id": "case_clockmaker_01",
    "display_name": "邻居证词",
    "description": "住在隔壁的安娜提供了证词：失踪当晚大约11点左右，她听到从失踪者公寓方向传来沉闷而有节奏的敲击声，持续了大约15分钟。随后是一声低沉的轰鸣，然后一切归于寂静。她因为害怕没有出门查看。",
    "source_type": "npc_statement",
    "location_id": "apartment",
    "reveals_fact_ids": ["fact_witness_sound"],
    "requires_any_tags": [],
    "requires_all_tags": [],
    "strength": 2,
    "missable": false
  },
  {
    "clue_id": "clue_medical_record",
    "case_id": "case_clockmaker_01",
    "display_name": "医疗记录",
    "description": "诊所保存的失踪者医疗记录显示，塞巴斯蒂安医生在失踪前三天曾为失踪者看诊，诊断为严重失眠和焦虑，并开出了含有缬草根萃取物的强效镇静剂。记录中提到了失踪者曾向医生提及\"看到不存在的影子\"。",
    "source_type": "document",
    "location_id": "clinic",
    "reveals_fact_ids": ["fact_doctor_visit", "fact_doctor_prescribed"],
    "requires_any_tags": [],
    "requires_all_tags": [],
    "strength": 3,
    "missable": false
  },
  {
    "clue_id": "clue_doctor_testimony",
    "case_id": "case_clockmaker_01",
    "display_name": "医生询问记录",
    "description": "调查员对塞巴斯蒂安医生的询问记录。医生承认在失踪前三天见过失踪者，但表示那只是一次常规的失眠诊疗。他声称只开了普通的安眠药。",
    "source_type": "document",
    "location_id": "clinic",
    "reveals_fact_ids": ["fact_doctor_visit"],
    "requires_any_tags": [],
    "requires_all_tags": [],
    "strength": 2,
    "missable": false
  },
  {
    "clue_id": "clue_shopkeeper_testimony",
    "case_id": "case_clockmaker_01",
    "display_name": "店主证词",
    "description": "星陨材料店的店主马尔科在反复追问下承认，他确实卖给失踪者一些蜡烛和草药，但坚称没有出售过任何\"危险物品\"。不过当被问及时之砂时，他神色明显紧张，敷衍几句后便拒绝再谈。进一步的询问可能让他吐露更多信息。",
    "source_type": "npc_statement",
    "location_id": "mystic_shop",
    "reveals_fact_ids": ["fact_material_source", "fact_entity_neutralized"],
    "requires_any_tags": [],
    "requires_all_tags": [],
    "strength": 2,
    "missable": false
  },
  {
    "clue_id": "clue_burnt_documents",
    "case_id": "case_clockmaker_01",
    "display_name": "烧焦的文件碎片",
    "description": "在公寓后院的焚烧桶中发现了一些未完全烧尽的文件碎片。碎片上隐约可见一些字迹，提到\"不要让任何人知道\"和\"处理掉那个东西\"。纸张质量与房东经常使用的记账本一致。",
    "source_type": "environment",
    "location_id": "apartment",
    "reveals_fact_ids": ["fact_landlord_hid_evidence"],
    "requires_any_tags": [],
    "requires_all_tags": [],
    "strength": 2,
    "missable": true
  },
  {
    "clue_id": "clue_landlord_contradiction",
    "case_id": "case_clockmaker_01",
    "display_name": "房东的矛盾陈述",
    "description": "房东弗雷德里克在分别询问中出现了矛盾的陈述。他先声称失踪者最近行为怪异，后又改口说一切正常。并且在被问及失踪者工坊时，他异常坚决地说\"那地方锁着，我从没进去过\"，但工坊门锁上留有新鲜的钥匙划痕。",
    "source_type": "npc_statement",
    "location_id": "apartment",
    "reveals_fact_ids": ["fact_landlord_hid_evidence"],
    "requires_any_tags": [],
    "requires_all_tags": [],
    "strength": 2,
    "missable": false
  },
  {
    "clue_id": "clue_spirit_vision_entity",
    "case_id": "case_clockmaker_01",
    "display_name": "灵视下的灵体痕迹",
    "description": "开启灵视后，能在工坊中看到一条黯淡的灰色灵体轨迹，从工坊中央的灼痕处延伸至角落的古旧钟表处。轨迹末端缠绕在钟表上，钟表周围的灵性波动异常活跃。隐约可见一个模糊的人形轮廓在钟表周围徘徊。",
    "source_type": "experiment",
    "location_id": "workshop",
    "reveals_fact_ids": ["fact_entity_unleashed", "fact_entity_bound"],
    "requires_any_tags": [],
    "requires_all_tags": [],
    "strength": 3,
    "missable": false
  },
  {
    "clue_id": "clue_trapped_clock",
    "case_id": "case_clockmaker_01",
    "display_name": "异常的古旧钟表",
    "description": "工坊角落立着一台做工精良的老爷钟，外壳上布满了细密的裂纹，三根指针指向完全不同的时间——且所有指针都在以不规则的速度缓慢移动。靠近钟表时能感到一阵阵寒意，隐约听到极低频率的嗡鸣声。钟表背板上刻有一段无法辨认的古老文字。",
    "source_type": "environment",
    "location_id": "workshop",
    "reveals_fact_ids": ["fact_entity_unleashed", "fact_entity_bound"],
    "requires_any_tags": [],
    "requires_all_tags": [],
    "strength": 3,
    "missable": false
  },
  {
    "clue_id": "clue_collector_knowledge",
    "case_id": "case_clockmaker_01",
    "display_name": "收藏家提供的封印知识",
    "description": "古董钟表收藏家阿尔德里奇在查看了工坊中发现的古旧钟表的描述后，神情变得严肃。他指出某些旧钟表在特定条件下可能成为\"灵性容器\"——如果仪式出错，释放的灵体会寻求最近的封闭空间寄宿。他提供了一种古老的净化封印仪式，可以安全中和被束缚的灵体。",
    "source_type": "npc_statement",
    "location_id": "police_office",
    "reveals_fact_ids": ["fact_entity_neutralized"],
    "requires_any_tags": [],
    "requires_all_tags": [],
    "strength": 3,
    "missable": false
  },
  {
    "clue_id": "clue_police_report",
    "case_id": "case_clockmaker_01",
    "display_name": "警方初步调查档案",
    "description": "哈罗德探员提供的初步调查档案。记录显示：失踪者埃里希·瓦赫特，41岁，钟表匠，独居。最后一次被人看见是三日前从诊所返回。公寓门锁完好，窗户从内部锁闭，没有发现强行进入的痕迹。现场未发现打斗迹象。探员在备注中写道：\"此案不寻常，建议由专门部门接手。\"",
    "source_type": "document",
    "location_id": "police_office",
    "reveals_fact_ids": ["fact_clockmaker_location"],
    "requires_any_tags": [],
    "strength": 1,
    "missable": false
  },
  {
    "clue_id": "clue_hidden_compartment",
    "case_id": "case_clockmaker_01",
    "display_name": "工坊暗格",
    "description": "在古旧钟表后方发现了一个隐蔽的暗格。暗格中散落着一些生活用品——一条毛毯、一个空水壶和几块干面包。暗格角落有一件沾满灰尘的外套，经过辨认确认是失踪者失踪当天所穿的衣物。暗格地板上有坐卧的痕迹。",
    "source_type": "environment",
    "location_id": "workshop",
    "reveals_fact_ids": ["fact_clockmaker_location"],
    "requires_any_tags": [],
    "requires_all_tags": ["clue_trapped_clock"],
    "strength": 3,
    "missable": false
  }
]
